5990	Изделия из фарфора, фаянса, полуфарфора и майолики (кроме медицинского, санитарного фаянса и химико-лабораторной посуды)	31
9388.3	Наборы антигенов и сывороток диагностические ветеринарные прочие	30
2321.1	Белила цинковые для розничной торговли (упаковка до 1 кг)	30
5445.1	Картон фильтровальный для пищевых жидкостей	29
7272.12	Составные части патронов ручного огнестрельного оружия: пыжи, пыжи контейнеры	29
9396.6	Узлы протезов нижних конечностей	29
9296.19	Комбикорма-концентраты для кроликов и нутрий	28
2388.3	Олифы	28
8460.1	Материалы хирургические, средства перевязочные	28
5481.1	Коробки для лекарственных средств	28
5463.5	Скатерти бумажные	27
9291.5	Витамин E (альфа-токоферола ацетат) микрогранулированный кормовой	27
2386	Средства против бытовых насекомых, грызунов для дезинфекции и антисептики	27
9450.6	Электрические одеяла, подушки и матрацы	27
3414.20	Разъединители, короткозамыкатели, отделители, заземлители высоковольтные для локомотивов и моторвагонного подвижного состава	25
8311.1	Материалы хирургические, средства перевязочные: марля медицинская 	24
9291.6	Витамин A (ретинола ацетат) микрогранулированный кормовой	24
9444.13	Электрокардиостимуляторы наружные	24
9437	Наборы медицинские	24
2386.2	Средства для борьбы с домашними грызунами	23
9692.1	Корм для певчих и декоративных птиц	23
9393	Материалы хирургические, средства перевязочные специальные	23
9441.7	Приборы для измерения частоты, скорости, ускорения, временных интервалов и перемещения	23
2321	Пигменты белые сухие	22
2530.2	Грелки резиновые (кроме изделий для ухода за детьми и подростками)	22
1483	Приборы столовые и принадлежности кухонные	22
9697.1	Сифоны бытовые и баллончики к ним	21
5500.2	Фанера общего назначения с наружными слоями из шпона хвойных пород	21
9436	Инструменты зондирующие, бужирующие	20
9451	Оборудование санитарно-гигиеническое, средства перемещения и перевозки	20
3481.2	Батареи аккумуляторные свинцовые нестартерные для мотоциклов и мотороллеров	20
2388	Материалы лакокрасочные	19
9391.2	Пластмассы стоматологические	19
9396.8	Костыли	19
9350.2	Аминокислоты, гидролизаты белков и ферменты для ветеринарии	19
2514	Изделия из латексов и клеев	18
9392	Средства дезинфекционные, дезинсекционные и дератизационные	18
9444.11	Протезы суставов вживляемые	18
5500.6	Заготовки клееные	18
5463.4	Платки носовые бумажные	17
9461.1	Изделия медицинские из стекла: бутылки стеклянные для крови, кровезаменителей, трансфузионных и инфузионных препаратов	17
9391.4	Металлы и изделия	17
5157.4	Кассеты к аппаратам для безопасных бритв	16
9396.7	Узлы протезов верхних конечностей	16
2331.1	Пигменты кадмиевые для розничной продажи (упаковка до 1 кг)	16
6582.1	Приемники радиовещательные и магнитолы автомобильные	16
9433.4	Ножницы медицинские	16
3412	Комплектные трансформаторные подстанции	15
2221	Материалы теплоизоляционные	15
2530.1	Маски резиновые для плавания под водой 	15
9296.18	Комбикорма-концентраты гранулированные для тренируемых и спортивных лошадей	15
5530	Плиты	14
3530	Кабели силовые для стационарной прокладки на напряжение свыше 1 кВ	14
9291.7	Витамин B12 кормовой	13
9439	Инструменты для ветеринарии, инструменты вспомогательные, принадлежности и приспособления разные	13
9398.3	Медицинские клеи	13
1991.2	Посуда и приборы столовые из мельхиора, нейзильбера с золотым или серебряным покрытием (кроме изделий для детей до 3 лет)	13
1482	Посуда из нержавеющей стали	12
9442.7	Источники рентгеновского излучения	12
2514.4	Изделия медицинские из латекса, медицинские клеи 	12
2182.2	Кальция фосфат кормовой	12
9695	Посуда и изделия хозяйственные металлические литые, из жести и листовой стали	12
9433.2	Инструменты однолезвийные	12
3482.5	Аккумуляторы щелочные никель-кадмиевые герметичные призматические	12
9296.15	Комбикорма-концентраты для рабочих лошадей	11
2420.1	Трубы круглого сечения сварные прочие, наружным диаметром более 406,4 мм, стальные, используемые для строительства, реконструкции и ремонта сетей водоснабжения и теплоснабжения	11
9280.1	Рыбий жир (кроме жира технического)	11
3414.18	Камеры сборные одностороннего обслуживания	11
9391.7	Изделия абразивные	10
9393.2	бинты гипсовые медицинские	10
9480	Линзы для коррекции зрения	10
9389.1	Сыворотки, антитела и прочие диагностические препараты, применяемые в медицине	10
2440	Средства защиты растений химические (пестициды)	10
2221.5	Материалы теплоизоляционные из пеностекла	10
9168.1	Кормовая продукция консервной и овощесушильной промышленности	9
2571	Изделия фрикционные	9
8464	Изделия медицинские из синтетической пряжи и нитей	9
9291	Продукция микробиологической промышленности	9
9432	Инструменты колющие	8
9350.1	Витамины синтетические водорастворимые и жирорастворимые для ветеринарии, препараты витаминные для ветеринарии	8
5620	Мебель специальная	8
5990.2	Изделия художественно-декоративные, подарочные и сувенирные керамические, применяемые для пищевых продуктов (вазы для пищевых продуктов, наборы для напитков, чайные, детские, свадебные)	8
9438	Изделия травматологические	8
9296.7	Комбикорма полнорационные гранулированные для кроликов	8
9433.3	Инструменты выкусывающие	8
9393.4	Пакеты перевязочные медицинские	7
9441.10	Генераторы сигналов диагностические, аудиометры	7
7272.13	Составные части патронов ручного огнестрельного оружия: дробь охотничья, спортивная и картечь	7
9444.8	Барокамеры и устройства для лечения повышенным и пониженным давлением	7
2545.1	Клеенка подкладная резино-тканевая (кроме клеенки для детей и подростков)	7
3540.1	Кабели силовые для нестационарной прокладки на напряжение свыше 1 кВ	7
5500.3	Фанера бакелизированная	7
9464.1	Щитки защитные лицевые	7
2387	Средства для защиты растений садов и огородов от сельскохозяйственных вредителей и сорняков и минеральные удобрения	7
9442.8	Кассеты рентгеновские	6
2545.2	Трубки медицинские резиновые 	6
1991	Посуда и изделия из сплавов цветных металлов	6
5772	Материалы и изделия полимерные прочие	6
5463	Товары бумажно-беловые	6
1481	Посуда хозяйственная стальная эмалированная	5
9441.8	Приборы для исследования звуковых колебаний в органах человека	5
2571.3	Материалы асбестовые фрикционные эластичные	5
9146	Продукция белковая, концентраты фосфатидные, ядро масличное, продукты переработки масличных семян, глицерин натуральный, соапстоки	5
9441.3	Электроэнцефалографы	5
3414.21	Переключатели и отключатели высоковольтные для подвижного состава	5
2571.2	Изделия фрикционные из ретинакса (кроме колодок тормозных и накладок тормозных, предназначенных для колесных транспортных средств)	4
3414.19	Реакторы и реакторное оборудование для электровозов и электропоездов	4
2530.3	Пузыри резиновые для льда (кроме изделий для ухода за детьми и подростками)	4
9296.11	Комбикорма полнорационные для беконного откорма свиней	4
1996	Посуда алюминиевая штампованная	4
5913	Стекло архитектурно-строительного назначения	4
8195	Вата и изделия ватные (из хлопковых, химических и шерстяных волокон)	3
9697	Приспособления для домашней обработки продуктов. Принадлежности столовые и кухонные. Изделия гончарные, щепные, бондарные, плетеные и другие	3
9385	Среды питательные микробиологические, основы питательные и сырье биологическое для вирусологических питательных сред, применяемых в медицине	3
9290	Продукция микробиологической и мукомольно-крупяной промышленности	3
5331.1	Брусья мостовые деревянные железных дорог широкой колеи, пропитанные защитными средствами	3
0253	Масла смазочные (нефтяные)	3
5500	Продукция фанерного производства, плиты, спички	3
9442.5	Рентгеновские питающие устройства	3
0272.4	Газы углеводородные сжиженные (кроме газов углеводородных сжиженных топливных для коммунально-бытового потребления и газов углеводородных сжиженных топливных для автомобильного транспорта)	3
9291.3	Дрожжи кормовые - паприн	3
3411	Трансформаторы силовые (однофазные мощностью свыше 4 кВ А, трехфазные мощностью 6,3 кВ А и свыше)	3
8461	Изделия медицинские из хлопчатобумажной пряжи	3
9398.4	Экраны: экраны рентгеновские	3
5500.4	Фанера авиационная	2
9442.9	Растры отсеивающие	2
5270	Конструкции и изделия (элементы) строительные из алюминия и алюминиевых сплавов	2
9683.1	Автоматические устройства управления бытовыми электрическими приборами, работающие автономно	2
9295	Продукция мукомольно-крупяной промышленности прочая, побочная и отходы	2
2526	Велошины, велопокрышки, велокамеры и велоизделия	2
9433	Инструменты режущие и ударные с острой (режущей) кромкой	2
2182	Удобрения фосфорные (фосфатные)	2
2372	Фотопленки	2
5711	Материалы строительные нерудные	2
3483	Элементы и батареи гальванические	2
9388.2	Антигены и фаги диагностические ветеринарные	2
9296.17	Комбикорма-концентраты гранулированные для откармливаемых лошадей	2
9382.4	Сыворотки прочие	2
3355.3	Вспомогательные электрические машины для подвижного состава железных дорог	2
3451.11	Стеклоочистители	2
5157	Изделия культурно-бытового назначения и хозяйственного обихода	2
5982	Посуда хозяйственная, термосы и колбы, изделия ламповые	2
0964.1	Прокат из коррозионно-стойкой стали для хирургических имплантатов	2
3414.11	Устройства электрошоковые	2
9158	Продукция косметическая	2
5743	Мел природный, сырье для производства вяжущих материалов. Мука известняковая и доломитовая и гипс сыромолотый	2
9296.4	Комбикорма-концентраты для дойных кобыл	2
9296.13	Комбикорма для контрольного откорма свиней	1
3456.11	Электрооборудование пассажирских вагонов	1
3185.30	Блочно-модульные тяговые подстанции систем электроснабжения электрифицированных железных дорог	1
9616.3	 Холодное оружие: сабли 	1
9291.10	Препарат ферментный протосубтилин ГЗх	1
3181.10	Стеклоочистители	1
7272	Патроны к гражданскому и служебному оружию, к средствам огнестрельным производственным и патроны, производимые только для экспорта в соответствии с техническими условиями, отвечающими требованиям стран-импортеров	1
9616.4	 Холодное оружие: шпаги	1
9442.6	Рентгеновские генераторы	1
3416.1	Преобразователи для подвижного состава железных дорог	1
3183.26	Стеклоочистители	1
3457.10	Предохранители высоковольтные для подвижного состава железных дорог	1
3454.6	Аппараты электрические тяговые для электровозов и электропоездов: реле электромагнитные, дифференциальные, боксования	1
5341.1	Шпалы деревянные для железных дорог широкой колеи, пропитанные защитными средствами	1
9296.16	Комбикорм-концентрат гранулированный для племенных кобыл	1
3184.9	Башмаки тормозных колодок подвижного состава магистральных железных дорог	1
2322.1	Ультрамарины для красок для розничной торговли (упаковка до 1 кг)	1
0110.1	Электрическая энергия в электрических сетях общего назначения переменного трехфазного и однофазного тока частотой 50 Гц	1
3414.7	Выключатели автоматические быстродействующие для подвижного состава железных дорог	1
9677	Изделия щетинно-щеточные	1
2571.4	Ленты асбестовые тормозные	1
9616.2	 Холодное оружие: луки спортивные массовые 	1
9387	Аллергены (включая аллергены для ветеринарии)	1
3414.1	Вентильные разрядники и ограничители перенапряжений для электроподвижного состава и устройств электроснабжения железных дорог	1
5711.1	Щебень для балластного слоя железных дорог из природного камня	1
9381.5	Гамма- и иммуноглобулины гетерогенные	1
9434	Инструменты оттесняющие	1
9435	Инструменты многоповерхностного воздействия (зажимные)	1
2553	Рукава напорные резинотканевые (прокладочные)	1
2545	Изделия медицинские, санитарно-гигиенические и предметы ухода за больными формовые	1
5361	Изделия столярные	1
9386	Бактериофаги (включая бактериофаги для ветеринарии)	1
5460	Тетради школьные ученические, обои и товары бумажно-беловые	1
3185.36	Статические преобразователи для устройств электроснабжения электрифицированных железных дорог	1
3457	Аппаратура, специально спроектированная для электровозов, тепловозов и газотурбовозов	1
9431	Инструменты механизированные	1
